{
  "$schema": "https://json-schema.org/draft/2020-12/schema",
  "$id": "urn:kenshi-oracle:scenario:0.1",
  "title": "Kenshi scenario 0.1",
  "description": "Each repetition reloads save. Times are calendar seconds relative to the first paused state captured after that load. At a shared time, actions execute in declared order before checkpoints. Repeatability is measured, never presumed.",
  "type": "object", "additionalProperties": false,
  "required": ["schema_version", "name", "save", "speed", "repeat", "actions", "checkpoints"],
  "properties": {
    "schema_version": {"const": "0.1"},
    "name": {"$ref": "#/$defs/safe_name"},
    "description": {"type": "string", "maxLength": 4096},
    "save": {"type": "string", "minLength": 1, "maxLength": 128, "pattern": "^[^\\u0000-\\u001f\\u007f<>:\"/\\\\|?*]+$", "description": "Existing local save name, never a path. Save files are not included in the repository."},
    "speed": {"$ref": "#/$defs/speed"},
    "repeat": {"type": "integer", "minimum": 1, "maximum": 100},
    "actions": {"type": "array", "maxItems": 10000, "items": {"$ref": "#/$defs/action"}},
    "checkpoints": {"type": "array", "minItems": 1, "maxItems": 10000, "items": {"$ref": "#/$defs/checkpoint"}}
  },
  "$defs": {
    "safe_name": {"type": "string", "minLength": 1, "maxLength": 80, "pattern": "^[A-Za-z0-9][A-Za-z0-9_-]*$"},
    "id": {"type": "string", "minLength": 1, "maxLength": 512, "pattern": "^[^\\u0000-\\u001f\\u007f]+$"},
    "time": {"type": "number", "minimum": 0, "maximum": 1000000000},
    "speed": {"type": "number", "minimum": 0, "maximum": 5},
    "position": {"type": "array", "minItems": 3, "maxItems": 3, "items": {"type": "number", "minimum": -10000000, "maximum": 10000000}},
    "checkpoint": {
      "type": "object", "additionalProperties": false, "required": ["at", "name"],
      "properties": {"at": {"$ref": "#/$defs/time"}, "name": {"$ref": "#/$defs/safe_name"}}
    },
    "action": {
      "oneOf": [
        {
          "type": "object", "additionalProperties": false, "required": ["at", "command", "params"],
          "properties": {
            "at": {"$ref": "#/$defs/time"}, "command": {"const": "pause"},
            "params": {"type": "object", "additionalProperties": false, "required": ["paused"], "properties": {"paused": {"type": "boolean"}}}
          }
        },
        {
          "type": "object", "additionalProperties": false, "required": ["at", "command", "params"],
          "properties": {
            "at": {"$ref": "#/$defs/time"}, "command": {"const": "set_game_speed"},
            "params": {"type": "object", "additionalProperties": false, "required": ["speed"], "properties": {"speed": {"$ref": "#/$defs/speed"}}}
          }
        },
        {
          "type": "object", "additionalProperties": false, "required": ["at", "command", "params"],
          "properties": {
            "at": {"$ref": "#/$defs/time"}, "command": {"const": "issue_order"},
            "params": {"$ref": "#/$defs/issue_order"}
          }
        }
      ]
    },
    "issue_order": {
      "type": "object", "additionalProperties": false,
      "required": ["type"],
      "properties": {
        "type": {"enum": ["move", "attack"]},
        "character_id": {"$ref": "#/$defs/id"}, "squad_id": {"$ref": "#/$defs/id"},
        "position": {"$ref": "#/$defs/position"}, "target_id": {"$ref": "#/$defs/id"}
      },
      "oneOf": [{"required": ["character_id"], "not": {"required": ["squad_id"]}}, {"required": ["squad_id"], "not": {"required": ["character_id"]}}],
      "allOf": [
        {"if": {"properties": {"type": {"const": "move"}}}, "then": {"required": ["position"], "not": {"required": ["target_id"]}}},
        {"if": {"properties": {"type": {"const": "attack"}}}, "then": {"required": ["target_id"], "not": {"required": ["position"]}}}
      ]
    }
  }
}
