{
  "schema_version": "0.1",
  "name": "ville-calme",
  "description": "Observe the user-provided local ville-calme save without issuing orders; no game files are included.",
  "save": "ville-calme",
  "speed": 1,
  "repeat": 3,
  "actions": [],
  "checkpoints": [
    {"at": 0, "name": "initial"},
    {"at": 120, "name": "deux-minutes"},
    {"at": 600, "name": "dix-minutes"}
  ]
}
